----------------------------------------------------------------------------
CrystalDiskInfo 8.12.7 (C) 2008-2021 hiyohiyo
                                Crystal Dew World: https://crystalmark.info/
----------------------------------------------------------------------------

    OS : Windows 11 Enterprise [10.0 Build 22621] (x64)
  Date : 2024/04/04 9:18:47

-- Controller Map ----------------------------------------------------------
 + Standard NVM Express Controller [SCSI]
   - WDC PC SN730 SDBQNTY-256G-1001
 - Microsoft Storage Spaces Controller [SCSI]
 - Microsoft VHD Loopback Controller [SCSI]

-- Disk List ---------------------------------------------------------------
 (01) WDC PC SN730 SDBQNTY-256G-1001 : 256,0 GB [0/0/0, sq] - nv

----------------------------------------------------------------------------
 (01) WDC PC SN730 SDBQNTY-256G-1001
----------------------------------------------------------------------------
           Model : WDC PC SN730 SDBQNTY-256G-1001
        Firmware : 11170101
   Serial Number : 213658802371
       Disk Size : 256,0 GB
     Buffer Size : Неизвестно
    # of Sectors : 
   Rotation Rate : ---- (SSD)
       Interface : NVM Express
   Major Version : NVM Express 1.3
   Minor Version : 
   Transfer Mode : PCIe 3.0 x4 | PCIe 3.0 x4
  Power On Hours : 2949 ч
  Power On Count : 524443 раз
      Host Reads : 37219 GB
     Host Writes : 28673 GB
     Temperature : 48 C (118 F)
   Health Status : Хорошо (91 %)
        Features : S.M.A.R.T., TRIM, VolatileWriteCache
       APM Level : ----
       AAM Level : ----
    Drive Letter : C:

-- S.M.A.R.T. --------------------------------------------------------------
ID RawValues(6) Attribute Name
01 000000000000 Критическое предупреждение
02 000000000141 Составная температура
03 000000000064 Доступный запас
04 00000000000A Порог доступного запаса
05 000000000009 Процент использования
06 000004A706F4 Единицы данных - чтение
07 000003958969 Единицы данных - запись
08 00005487A42A Команды хост-чтения
09 0000501CC4A5 Команды хост-записи
0A 000000000C5A Время работы контроллера
0B 00000008009B Включения/отключения
0C 000000000B85 Часы работы
0D 00000000000B Небезопасные отключения
0E 000000000000 Ошибки целостности носителя и данных
0F 000000000009 Записи в журнале информации об ошибках

-- IDENTIFY_DEVICE ---------------------------------------------------------
        0    1    2    3    4    5    6    7    8    9
000: 15B7 15B7 3132 3633 3835 3038 3332 3137 2020 2020
010: 2020 2020 4457 2043 4350 5320 374E 3033 5320 4244
020: 4E51 5954 322D 3635 2D47 3031 3130 2020 2020 2020
030: 2020 2020 3131 3731 3130 3130 4404 001B 0700 2017
040: 0300 0001 A120 0007 4240 000F 0200 0000 0002 0000
050: 0000 0000 0000 0000 0000 0000 0000 0000 0000 0000
060: 0000 0000 0000 0000 0000 0000 0000 0000 0000 0000
070: 0000 0000 0000 0000 0000 0000 0000 0000 0000 0000
080: 0000 0000 0000 0000 0000 0000 0000 0000 0000 0000
090: 0000 0000 0000 0000 0000 0000 0000 0000 0000 0000
100: 0000 0000 0000 0000 0000 0000 0000 0000 0000 0000
110: 0000 0000 0000 0000 0000 0000 0000 0000 0000 0000
120: 0000 0000 0000 0000 0000 0000 0000 0000 0017 0704
130: 1E14 04FF 0101 0165 0169 0032 0000 0000 0000 0000
140: 6000 9E65 003B 0000 0000 0000 0000 0000 0000 0000
150: 0000 0000 0000 0000 0000 0000 0000 0000 001A 0101
160: 0000 0001 0111 0165 0003 6000 0000 0000 0000 0000
170: 0000 0000 0000 0000 0000 0000 0001 0000 0000 0000
180: 0000 0000 0000 0000 0000 0000 0000 0000 0000 0000
190: 0000 0000 0000 0000 0000 0000 0000 0000 0000 0000
200: 0000 0000 0000 0000 0000 0000 0000 0000 0000 0000
210: 0000 0000 0000 0000 0000 0000 0000 0000 0000 0000
220: 0000 0000 0000 0000 0000 0000 0000 0000 0000 0000
230: 0000 0000 0000 0000 0000 0000 0000 0000 0000 0000
240: 0000 0000 0000 0000 0000 0000 0000 0000 0000 0000
250: 0000 0000 0000 0000 0000 0000

-- SMART_NVME --------------------------------------------------------------
     +0 +1 +2 +3 +4 +5 +6 +7 +8 +9 +A +B +C +D +E +F
000: 00 41 01 64 0A 09 00 00 00 00 00 00 00 00 00 00
010: 00 00 00 00 00 00 00 00 00 00 00 00 00 00 00 00
020: F5 06 A7 04 00 00 00 00 00 00 00 00 00 00 00 00
030: 6D 89 95 03 00 00 00 00 00 00 00 00 00 00 00 00
040: 47 A4 87 54 00 00 00 00 00 00 00 00 00 00 00 00
050: ED C4 1C 50 00 00 00 00 00 00 00 00 00 00 00 00
060: 5A 0C 00 00 00 00 00 00 00 00 00 00 00 00 00 00
070: 9B 00 08 00 00 00 00 00 00 00 00 00 00 00 00 00
080: 85 0B 00 00 00 00 00 00 00 00 00 00 00 00 00 00
090: 0B 00 00 00 00 00 00 00 00 00 00 00 00 00 00 00
0A0: 00 00 00 00 00 00 00 00 00 00 00 00 00 00 00 00
0B0: 09 00 00 00 00 00 00 00 00 00 00 00 00 00 00 00
0C0: 00 00 00 00 00 00 00 00 00 00 00 00 00 00 00 00
0D0: 00 00 00 00 00 00 00 00 00 00 00 00 00 00 00 00
0E0: 00 00 00 00 00 00 00 00 00 00 00 00 00 00 00 00
0F0: 00 00 00 00 00 00 00 00 00 00 00 00 00 00 00 00
100: 00 00 00 00 00 00 00 00 00 00 00 00 00 00 00 00
110: 00 00 00 00 00 00 00 00 00 00 00 00 00 00 00 00
120: 00 00 00 00 00 00 00 00 00 00 00 00 00 00 00 00
130: 00 00 00 00 00 00 00 00 00 00 00 00 00 00 00 00
140: 00 00 00 00 00 00 00 00 00 00 00 00 00 00 00 00
150: 00 00 00 00 00 00 00 00 00 00 00 00 00 00 00 00
160: 00 00 00 00 00 00 00 00 00 00 00 00 00 00 00 00
170: 00 00 00 00 00 00 00 00 00 00 00 00 00 00 00 00
180: 00 00 00 00 00 00 00 00 00 00 00 00 00 00 00 00
190: 00 00 00 00 00 00 00 00 00 00 00 00 00 00 00 00
1A0: 00 00 00 00 00 00 00 00 00 00 00 00 00 00 00 00
1B0: 00 00 00 00 00 00 00 00 00 00 00 00 00 00 00 00
1C0: 00 00 00 00 00 00 00 00 00 00 00 00 00 00 00 00
1D0: 00 00 00 00 00 00 00 00 00 00 00 00 00 00 00 00
1E0: 00 00 00 00 00 00 00 00 00 00 00 00 00 00 00 00
1F0: 00 00 00 00 00 00 00 00 00 00 00 00 00 00 00 00

